{
  "type": "object",
  "properties": {
    "status": {
      "type": "string",
      "enum": [
        "SUCCESS",
        "FAIL",
        "SKIP"
      ]
    },
    "reason": {
      "type": "string"
    },
    "attempts": {
      "type": "integer",
      "minimum": 1
    },
    "artifacts": {
      "type": "object",
      "properties": {
        "branch": {
          "type": "string"
        },
        "diff": {
          "type": "string"
        },
        "provider": {
          "type": "string"
        },
        "model": {
          "type": "string"
        }
      },
      "required": [
        "branch",
        "diff",
        "model",
        "provider"
      ],
      "additionalProperties": false
    },
    "rules_fired": {
      "type": "array",
      "items": {
        "type": "string"
      }
    },
    "results": {
      "type": "object",
      "properties": {
        "claims": {
          "type": "array",
          "items": {
            "type": "object",
            "properties": {
              "claim": {
                "type": "string"
              },
              "status": {
                "type": "string",
                "enum": [
                  "VERIFIED",
                  "NOT_FOUND",
                  "CONFLICT"
                ]
              },
              "file": {
                "type": "string"
              },
              "line": {
                "type": "integer",
                "minimum": 0
              },
              "inspected_files": {
                "type": "array",
                "items": {
                  "type": "string"
                }
              }
            },
            "required": [
              "claim",
              "file",
              "inspected_files",
              "line",
              "status"
            ],
            "additionalProperties": false
          }
        }
      },
      "required": [
        "claims"
      ],
      "additionalProperties": false
    }
  },
  "required": [
    "artifacts",
    "attempts",
    "reason",
    "results",
    "rules_fired",
    "status"
  ],
  "additionalProperties": false,
  "$schema": "https://json-schema.org/draft/2020-12/schema",
  "allOf": [
    {
      "if": {
        "properties": {
          "status": {
            "enum": [
              "FAIL",
              "SKIP"
            ]
          }
        }
      },
      "then": {
        "properties": {
          "reason": {
            "minLength": 1
          }
        }
      }
    }
  ]
}
