{"status": "SUCCESS", "reason": "All 16 cited repo Sources in docs/35/SPEC.md were checked against actual file content at HEAD (commit 92b5d71, branch nightshift/35, matching the SPEC's stated commit). Every cited line range exists, is within file bounds, and supports the claim attributed to it. Upstream ticket.json ACs 1-8 are verbatim-identical to SPEC ACs 1-8 (full coverage, no drift). The controller-added Guardrails paragraph (ingest CLI, provider-usage CLI, receipt field list) is internally consistent with the Solution Design section's identity/overlap/persistence semantics \u2014 no substantive inconsistency found. No NOT_FOUND or CONFLICT identifiers surfaced.", "attempts": 1, "artifacts": {"branch": "nightshift/35", "diff": "", "model": "sonnet", "provider": "claude"}, "results": {"claims": [{"claim": "observational contract and current enums (STAGES/PROVIDERS/ROLES/STATUSES/TERMINAL_STATUSES/PREFLIGHT_REASONS, SCHEMA_VERSION=1, docstring on nonfatal metrics behavior)", "file": "scripts/nightshift-run-metrics.py", "line": 1, "inspected_files": ["scripts/nightshift-run-metrics.py"], "status": "VERIFIED"}, {"claim": "Git persistence, atomic writes (_git_common_dir, _atomic_write), and cmd_init run initialization under <git-common-dir>/nightshift/runs/<run_id>", "file": "scripts/nightshift-run-metrics.py", "line": 145, "inspected_files": ["scripts/nightshift-run-metrics.py"], "status": "VERIFIED"}, {"claim": "current observation receipt fields (invocation_id, stage, provider, model, role, status, usage.input_tokens/output_tokens) and replay logic in _read_events", "file": "scripts/nightshift-run-metrics.py", "line": 264, "inspected_files": ["scripts/nightshift-run-metrics.py"], "status": "VERIFIED"}, {"claim": "current deduplication (dict-keyed by invocation_id / repair tuple), aggregation of input/output totals, and atomic summary.json write", "file": "scripts/nightshift-run-metrics.py", "line": 390, "inspected_files": ["scripts/nightshift-run-metrics.py"], "status": "VERIFIED"}, {"claim": "role observation boundary emit_observation() and stage attribution via role_stage($ROLE) / STAGE_OVERRIDE", "file": "scripts/nightshift-agent.sh", "line": 31, "inspected_files": ["scripts/nightshift-agent.sh"], "status": "VERIFIED"}, {"claim": "provider commands (claude/codex/local dispatch) and current usage parsing: Claude usage read from single result envelope before .structured_output/.result projection discards it; Codex/local usage stays null (no documented structured usage event observed)", "file": "scripts/nightshift-agent.sh", "line": 207, "inspected_files": ["scripts/nightshift-agent.sh"], "status": "VERIFIED"}, {"claim": "run context propagation (NIGHTSHIFT_RUN_ID/NIGHTSHIFT_RUN_DIR export) and non-gating run_metrics_summary()", "file": "scripts/nightshift-factory.sh", "line": 200, "inspected_files": ["scripts/nightshift-factory.sh"], "status": "VERIFIED"}, {"claim": "orchestrator provider boundary and observations: factory-level observation events emitted on interruption and on codex/claude child completion with invocation-id factory-$NIGHTSHIFT_RUN_ID", "file": "scripts/nightshift-factory.sh", "line": 459, "inspected_files": ["scripts/nightshift-factory.sh"], "status": "VERIFIED"}, {"claim": "identity derivation contract (--derive-id: gh/jira/monday/notion/bd/task ref handling, source/source_id/external_ref emission)", "file": "scripts/nightshift-ticket-source.sh", "line": 35, "inspected_files": ["scripts/nightshift-ticket-source.sh"], "status": "VERIFIED"}, {"claim": "current GitHub identity loss and fetched URL: fetch_gh() returns source/source_id/external_ref (gh-<id>)/title/body/labels/url/state with no repository field", "file": "scripts/nightshift-ticket-source.sh", "line": 157, "inspected_files": ["scripts/nightshift-ticket-source.sh"], "status": "VERIFIED"}, {"claim": "persisted run summary schema example and current token semantics (input_tokens/output_tokens only, usage.complete flag, terminal_status enum)", "file": "docs/RUN-MEASUREMENTS.md", "line": 68, "inspected_files": ["docs/RUN-MEASUREMENTS.md"], "status": "VERIFIED"}, {"claim": "stage/role->stage map, privacy scrubbing (never captures prompts/transcripts/paths/credentials), and non-fatal metrics failure behavior", "file": "docs/RUN-MEASUREMENTS.md", "line": 130, "inspected_files": ["docs/RUN-MEASUREMENTS.md"], "status": "VERIFIED"}, {"claim": "subscription-default authentication policy and unknown-not-zero usage/cost policy statement", "file": "docs/NIGHTSHIFT-COST-POLICY.md", "line": 1, "inspected_files": ["docs/NIGHTSHIFT-COST-POLICY.md"], "status": "VERIFIED"}, {"claim": "existing provider fixture and regression baseline covering AC4-6 (concurrency, unknowns, secret exclusion, reported usage propagation)", "file": "tests/test-run-metrics.sh", "line": 1, "inspected_files": ["tests/test-run-metrics.sh"], "status": "VERIFIED"}, {"claim": "public scenario artifact schema (version, task, ac_ids, author, applicability, runtime, prototype_files, cases, heldout), classification kinds, risks, and review fields", "file": "docs/BEHAVIOR-PROOF.md", "line": 1, "inspected_files": ["docs/BEHAVIOR-PROOF.md"], "status": "VERIFIED"}, {"claim": "project identity resolution rules and authoritative test/deployment-command selection precedence", "file": "docs/PROJECT-CONTEXT.md", "line": 1, "inspected_files": ["docs/PROJECT-CONTEXT.md"], "status": "VERIFIED"}, {"claim": "Upstream acceptance coverage: ticket.json ACs 1-8 are verbatim-identical to SPEC Acceptance Criteria AC1-AC8; 'Should have' items (stage breakdowns, GitHub comment) are correctly treated as non-required and explicitly deferred in SPEC Open Questions, matching ticket's 'Delivery priority' note that these must not displace required accounting correctness", "file": "docs/35/ticket.json", "line": 6, "inspected_files": ["docs/35/ticket.json", "docs/35/SPEC.md"], "status": "VERIFIED"}, {"claim": "Controller-added Guardrails (ingest subcommand, nightshift-provider-usage.py CLI, receipt field list including coverage_scope/parent_invocation_id/included_invocation_ids/child_kind) are consistent with, and additive to, the Solution Design's identity/overlap/persistence semantics; no contradiction found between the two sections", "file": "docs/35/SPEC.md", "line": 0, "inspected_files": ["docs/35/SPEC.md"], "status": "VERIFIED"}]}, "rules_fired": ["tier1-exact-grep-not-needed-direct-line-read", "file-path-existence-check", "line-range-bounds-check", "upstream-ac-diff-check", "guardrails-vs-solution-design-consistency-check"]}