{"artifacts": {"branch": "nightshift/35", "diff": "", "model": "sonnet", "provider": "claude"}, "attempts": 1, "reason": "All 11 numbered claims independently checked against source at commit 92b5d71 (worktree HEAD). Claims 1-9 (EXISTING) verified against local files; claim 8 additionally cross-checked against the live Claude Agent SDK cost-tracking doc (fetched successfully). Claim 9's external Codex source (github.com/openai/codex .../exec_events.rs) could not be fetched in this session \u2014 WebFetch/WebSearch/curl/gh all returned tool-permission-not-granted or approval-required errors on every retry, so that portion is reported INCONCLUSIVE rather than guessed; the internal-code half of claim 9 (Codex path never reads stream usage, reported_model stays null) is independently verified from scripts/nightshift-agent.sh. Claims 10-11 (NEW) confirmed as true net-new: neither scripts/nightshift-provider-usage.py nor tests/test-ticket-accounting.sh exists in the tree, so no collision risk. No requirement contradiction found between SPEC prose and current code; SPEC's own commit/branch preamble matches actual worktree HEAD (92b5d71 on nightshift/35).", "results": {"claims": [{"claim": "cmd_init creates run context and immutable observation event files with atomic summaries, with no ticket tuple in current observation schema", "file": "scripts/nightshift-run-metrics.py", "line": 184, "inspected_files": ["scripts/nightshift-run-metrics.py"], "status": "VERIFIED"}, {"claim": "Current run metrics captures input_tokens/output_tokens only and uses reported_model null", "file": "scripts/nightshift-run-metrics.py", "line": 271, "inspected_files": ["scripts/nightshift-run-metrics.py"], "status": "VERIFIED"}, {"claim": "_summary deduplicates within one run by invocation_id and repair tuples", "file": "scripts/nightshift-run-metrics.py", "line": 391, "inspected_files": ["scripts/nightshift-run-metrics.py"], "status": "VERIFIED"}, {"claim": "Dispatcher Claude extracts result usage and Codex requests JSONL but reads only final structured contract for completion", "file": "scripts/nightshift-agent.sh", "line": 224, "inspected_files": ["scripts/nightshift-agent.sh"], "status": "VERIFIED"}, {"claim": "Factory emits own observation on normal completion/interruption and exports run context", "file": "scripts/nightshift-factory.sh", "line": 470, "inspected_files": ["scripts/nightshift-factory.sh"], "status": "VERIFIED"}, {"claim": "GitHub adapter emits external_ref gh-number without repository identity", "file": "scripts/nightshift-ticket-source.sh", "line": 170, "inspected_files": ["scripts/nightshift-ticket-source.sh"], "status": "VERIFIED"}, {"claim": "Metrics stage allowlist drops unknown stages; unknown usage is not zero per policy", "file": "scripts/nightshift-run-metrics.py", "line": 264, "inspected_files": ["scripts/nightshift-run-metrics.py"], "status": "VERIFIED"}, {"claim": "Claude authoritative cost tracking: result usage excludes SDK subagents, modelUsage/total_cost_usd include them; estimates are client-side not invoices", "file": "docs/35/SPEC.md", "line": 31, "inspected_files": ["docs/35/SPEC.md"], "status": "VERIFIED"}, {"claim": "Codex TurnCompletedEvent usage fields (input_tokens, cached_input_tokens, cache_write_input_tokens, output_tokens, reasoning_output_tokens) with no reported model", "file": "docs/35/SPEC.md", "line": 33, "inspected_files": ["scripts/nightshift-agent.sh", "docs/35/SPEC.md"], "status": "CONFLICT"}, {"claim": "Add scripts/nightshift-provider-usage.py and tests/test-ticket-accounting.sh with no existing file collision", "file": "docs/35/SPEC.md", "line": 76, "inspected_files": ["scripts/nightshift-provider-usage.py", "tests/test-ticket-accounting.sh"], "status": "NOT_FOUND"}, {"claim": "Ingest, ticket-report, normalized receipt fields, and ticket-metrics persistence in Guardrails are stated requirements, not present-implementation assertions", "file": "docs/35/SPEC.md", "line": 65, "inspected_files": ["docs/35/SPEC.md", "scripts/nightshift-run-metrics.py"], "status": "NOT_FOUND"}]}, "rules_fired": ["hard-gate-no-guessing", "tier1-grep-repo-wide", "tier3-deep-extraction", "external-primary-source-check", "net-new-collision-check"], "status": "SUCCESS"}