{
  "status": "SUCCESS",
  "reason": "Verified the token-semantics claim against the two cited snapshot files. Two of three sub-claims (input+output=total_tokens; reasoning as an output-token detail, not additive) match the snapshot content exactly. The 'fresh = input - read - write' formula conflicts with the actual non_cached_input definition in the semantics snapshot, which subtracts only cached_input_tokens (cache-read), not cache_write_input_tokens.",
  "attempts": 3,
  "artifacts": {
    "branch": "",
    "diff": "",
    "provider": "claude",
    "model": "sonnet"
  },
  "rules_fired": [
    "tier1-exact-read",
    "no-shell-needed",
    "content-comparison-only"
  ],
  "results": {
    "claims": [
      {
        "claim": "overall total = input_tokens + output_tokens (cache-read/cache-write are input-token details, not additive to total; reasoning is an output-token detail, not additive to total)",
        "file": "docs/35/codex-response-usage.txt",
        "line": 917,
        "status": "VERIFIED",
        "inspected_files": [
          "docs/35/codex-response-usage.txt"
        ]
      },
      {
        "claim": "fresh (non-cached) input tokens = input_tokens - cached_input_tokens - cache_write_input_tokens",
        "file": "docs/35/codex-token-semantics.txt",
        "line": 2421,
        "status": "CONFLICT",
        "inspected_files": [
          "docs/35/codex-token-semantics.txt"
        ]
      }
    ]
  }
}
