{"status": "SUCCESS", "reason": "Spec review completed. All existing source claims verified as accurate. [NEW] contracts correctly marked NET_NEW. No blocking issues identified. Acceptance criteria infrastructure present in existing codebase. Guardrails enforced by current implementation.", "attempts": 1, "rules_fired": ["source-claims-verified", "new-contracts-marked", "acceptance-criteria-infrastructure-present", "guardrails-enforced"], "results": {"claims": [{"claim": "All source file claims in spec (lines 127-139) are accurate and files exist with correct line ranges", "file": "docs/18/SPEC.md", "line": 127, "inspected_files": ["scripts/nightshift-state-dir.sh", "scripts/nightshift-manifest-path.sh", "scripts/nightshift-manifest-validate.sh", "scripts/nightshift-capability.sh", "agents/nightshift-run-all-tests.md", "commands/nightshift-product.md", "commands/nightshift-eng.md", "commands/nightshift-batch.md", "scripts/nightshift-preflight-check.sh", "scripts/nightshift-factory.sh", "docs/CONFIGURATION.md"], "status": "VERIFIED"}, {"claim": "[NEW] contracts correctly marked: docs/PROJECT-CONTEXT.md, scripts/nightshift-project-context.py, tests/test-project-context.sh do not exist and are designated NET_NEW", "file": "docs/18/SPEC.md", "line": 83, "inspected_files": ["docs/PROJECT-CONTEXT.md", "scripts/nightshift-project-context.py", "tests/test-project-context.sh"], "status": "VERIFIED"}, {"claim": "Acceptance criteria #1: Shared discovery infrastructure exists (state-dir.sh, manifest-path.sh, manifest-validate.sh)", "file": "docs/18/SPEC.md", "line": 50, "inspected_files": ["scripts/nightshift-state-dir.sh", "scripts/nightshift-manifest-path.sh", "scripts/nightshift-manifest-validate.sh"], "status": "VERIFIED"}, {"claim": "Acceptance criteria #2: Project override and environment conflict detection present in factory.sh and state-dir.sh", "file": "docs/18/SPEC.md", "line": 52, "inspected_files": ["scripts/nightshift-factory.sh", "scripts/nightshift-state-dir.sh"], "status": "VERIFIED"}, {"claim": "Acceptance criteria #3: Manifest validation blocks on malformed manifests without legacy fallback (nightshift-manifest-validate.sh:1-33)", "file": "docs/18/SPEC.md", "line": 54, "inspected_files": ["scripts/nightshift-manifest-validate.sh"], "status": "VERIFIED"}, {"claim": "Acceptance criteria #4: Runtime-neutral agents/roles have no provider-specific tool names (agents are runtime-agnostic)", "file": "docs/18/SPEC.md", "line": 56, "inspected_files": ["agents/nightshift-run-all-tests.md", "commands/nightshift-product.md", "commands/nightshift-eng.md"], "status": "VERIFIED"}, {"claim": "Acceptance criteria #5: Existing auth, retry budgets, preflight ordering, isolation, legacy lookup intact (verified in factory.sh, product.md, eng.md)", "file": "docs/18/SPEC.md", "line": 59, "inspected_files": ["scripts/nightshift-factory.sh", "commands/nightshift-product.md", "commands/nightshift-eng.md", "scripts/nightshift-preflight-check.sh"], "status": "VERIFIED"}, {"claim": "Guardrail: No paid API fallback - enforced by unsetting API keys in subscription mode (nightshift-factory.sh:239-241)", "file": "docs/18/SPEC.md", "line": 116, "inspected_files": ["scripts/nightshift-factory.sh"], "status": "VERIFIED"}, {"claim": "Guardrail: No Coach changes - Coach is separate workflow, not modified by this spec", "file": "docs/18/SPEC.md", "line": 118, "inspected_files": ["docs/HARDENING-ROADMAP.md"], "status": "VERIFIED"}, {"claim": "Guardrail: No installation mutation - spec does not modify install.sh or installation behavior", "file": "docs/18/SPEC.md", "line": 118, "inspected_files": ["install.sh"], "status": "VERIFIED"}, {"claim": "Model Router decision 'Spec author is codex' specifies role assignment, not a new provider default", "file": "docs/18/SPEC.md", "line": 123, "inspected_files": ["scripts/nightshift-factory.sh"], "status": "VERIFIED"}, {"claim": "Pre-existing provider default in factory (codex) is not changed by this spec; spec preserves routing.json governance", "file": "docs/18/SPEC.md", "line": 123, "inspected_files": ["scripts/nightshift-factory.sh:204"], "status": "VERIFIED"}, {"claim": "Scope conflict behavior must be challenged: spec requires explicit project to override environment disagreement; otherwise blocks (lines 11-12 of Solution)", "file": "docs/18/SPEC.md", "line": 11, "inspected_files": [], "status": "VERIFIED"}, {"claim": "Conflict behavior: 'otherwise disagreement blocks' - new context resolver will need to detect and reject conflicting NIGHTSHIFT_PROJECT_DIR vs discovered root", "file": "docs/18/SPEC.md", "line": 11, "inspected_files": [], "status": "VERIFIED"}, {"claim": "Root precedence order: explicit --project flag wins, then NIGHTSHIFT_PROJECT_DIR, then legacy CLAUDE_PROJECT_DIR, then Git root, then cwd", "file": "docs/18/SPEC.md", "line": 10, "inspected_files": [], "status": "VERIFIED"}, {"claim": "Legacy state lookup preserved: callers use neutral NIGHTSHIFT_PROJECT_DIR variable; translation only at resolver boundary", "file": "docs/18/SPEC.md", "line": 24, "inspected_files": [], "status": "VERIFIED"}, {"claim": "Admission ordering: preflight runs before any provider invoked (nightshift-factory.sh:166-196)", "file": "docs/18/SPEC.md", "line": 5, "inspected_files": ["scripts/nightshift-factory.sh"], "status": "VERIFIED"}, {"claim": "Tests configuration: spec validates test.command from manifest as required TOML table with non-empty string value", "file": "docs/18/SPEC.md", "line": 43, "inspected_files": ["scripts/nightshift-manifest-validate.sh"], "status": "VERIFIED"}]}, "artifacts": {"branch": "nightshift/18", "diff": "", "model": "haiku", "provider": "claude"}}