{
  "artifacts": {
    "branch": "nightshift/35",
    "diff": "",
    "model": "sonnet",
    "provider": "claude"
  },
  "attempts": 3,
  "reason": "Both claims verified against source with no unresolved contradiction; review complete.",
  "results": {
    "claims": [
      {
        "claim": "Codex non_cached_input() = input_tokens minus cached_input() (cache reads only), so it does not subtract cache_write_input_tokens and therefore its value includes cache writes; Codex's own reported total_tokens/blended_total does not re-add cache-read/cache-write/reasoning details on top of input+output.",
        "file": "docs/35/codex-token-semantics.txt",
        "line": 2421,
        "status": "VERIFIED",
        "inspected_files": [
          "docs/35/codex-token-semantics.txt",
          "docs/35/codex-response-usage.txt"
        ]
      },
      {
        "claim": "non_cached_input() body is `(self.input_tokens - self.cached_input()).max(0)` where cached_input() = cached_input_tokens.max(0) — confirms cache reads only are subtracted, cache writes are not, so cache writes remain inside the returned value.",
        "file": "docs/35/codex-token-semantics.txt",
        "line": 2422,
        "status": "VERIFIED",
        "inspected_files": [
          "docs/35/codex-token-semantics.txt"
        ]
      },
      {
        "claim": "blended_total() = (non_cached_input() + output_tokens.max(0)).max(0) — the provider-side 'primary count' is non-cached-input plus output only; it does not separately re-add cached_input_tokens, cache_write_input_tokens, or reasoning_output_tokens.",
        "file": "docs/35/codex-token-semantics.txt",
        "line": 2426,
        "status": "VERIFIED",
        "inspected_files": [
          "docs/35/codex-token-semantics.txt"
        ]
      },
      {
        "claim": "Struct-level fixture: TokenUsage carries input_tokens, cached_input_tokens, cache_write_input_tokens, output_tokens, reasoning_output_tokens, and total_tokens as distinct fields, populated from ResponseCompletedUsage/ResponseCompletedInputTokensDetails/ResponseCompletedOutputTokensDetails.",
        "file": "docs/35/codex-response-usage.txt",
        "line": 141,
        "status": "VERIFIED",
        "inspected_files": [
          "docs/35/codex-response-usage.txt"
        ]
      },
      {
        "claim": "Upstream test fixture: input_tokens=100, cached_tokens=40, cache_write_tokens=60, output_tokens=10, reasoning_tokens=5, total_tokens=110 — matches the numbers used in the NEW claim's worked example exactly.",
        "file": "docs/35/codex-response-usage.txt",
        "line": 909,
        "status": "VERIFIED",
        "inspected_files": [
          "docs/35/codex-response-usage.txt"
        ]
      },
      {
        "claim": "total_tokens=110 equals input_tokens(100)+output_tokens(10); it is not input+output+cached(40)+cache_write(60)+reasoning(5), i.e. the provider's total field is input+output only, consistent with claim 1's 'total does not add cache/reasoning details.'",
        "file": "docs/35/codex-response-usage.txt",
        "line": 917,
        "status": "VERIFIED",
        "inspected_files": [
          "docs/35/codex-response-usage.txt"
        ]
      },
      {
        "claim": "SPEC.md defines a NEW Nightshift-normalized `fresh_input` category for Codex as input_tokens minus cache reads minus cache writes, explicitly distinct from Codex's own non_cached_input(); validates read+write does not exceed input_tokens before subtracting both; total is set to provider input+output (cached/reasoning never re-added).",
        "file": "docs/35/SPEC.md",
        "line": 35,
        "status": "VERIFIED",
        "inspected_files": [
          "docs/35/SPEC.md"
        ]
      },
      {
        "claim": "Applying the SPEC-defined fresh_input formula to the fixture (input100/read40/write60/output10/reasoning5/total110): read(40)+write(60)=100 does not exceed input_tokens(100) [boundary case, exactly equal], so fresh_input = 100-40-60 = 0. The four normalized categories (fresh0, read40, write60, output10) sum to 110, matching provider total_tokens. Codex non_cached_input() on the same fixture = 100-40 = 60, distinct from Nightshift fresh_input=0 as intended. No inconsistency found: fresh_input is non-negative, the read+write validation boundary holds (equality, not exceedance), and the two normalization schemes diverge by design rather than by contradiction.",
        "file": "docs/35/SPEC.md",
        "line": 35,
        "status": "VERIFIED",
        "inspected_files": [
          "docs/35/SPEC.md",
          "docs/35/codex-response-usage.txt",
          "docs/35/codex-token-semantics.txt"
        ]
      }
    ]
  },
  "rules_fired": [
    "HARD-GATE-verify-before-write",
    "tier1-exact-grep-and-read",
    "codex-fact-extractor-report-format"
  ],
  "status": "SUCCESS"
}
