{
  "status": "SUCCESS",
  "artifacts": {
    "branch": "nightshift/18",
    "diff": " agents/nightshift-run-all-tests.md | 33 ++++++++++++++++++++-------\n docs/18/SPEC.md                    |  9 ++++++++\n tests/test-factory-auth.sh         |  1 +\n tests/test-state-dir.sh            |  1 +\n 4 files changed, 37 insertions(+), 7 deletions(-)  (delta since prior APPROVE in docs/18/review.out.json; full diff vs origin/integration/nightshift is 44 files, 535+/67-, unchanged from prior review except these four)",
    "model": "sonnet",
    "provider": "claude"
  },
  "attempts": 1,
  "reason": "APPROVE. Bounded follow-up review of only the delta since the prior APPROVE (docs/18/review.out.json): (1) agents/nightshift-run-all-tests.md Step 1's new mandatory pre-execution gate, (2) the docs/18/SPEC.md amendment documenting it plus the Files-to-Change additions, and (3) the two test-fixture line additions. All three are faithful to docs/18/SPEC.md and docs/PROJECT-CONTEXT.md and introduce no regression. The new Step 1 text requires reading every path in the resolver's `conventions` array (verified real field name, populated with AGENTS.md then CLAUDE.md per ancestor in scripts/nightshift-project-context.py's discover()), blocks with AGENT BLOCKED naming both sources+line numbers on an explicit-command conflict between AGENTS.md/CLAUDE.md, restricts legacy fallback to when the neutral source is silent, and requires recording the selected command/source/line/scope/fallback rationale before execution — this is a verbatim match to PROJECT-CONTEXT.md's Convention decision steps 1–3 and satisfies SPEC.md's AC1/AC4 (typed conflict handling, legacy-fallback preservation, block-don't-guess). The 'structured status FAIL, passed 0' phrasing is not an invented field: README.md:400 and commands/nightshift-implement.md's Step 9 JSON contract already document status SUCCESS|FAIL|SKIP plus nonnegative results.passed/results.failed for this exact role, so the phrase describes the existing dispatcher-wrapper contract, not new behavior. docs/18/SPEC.md was correctly amended: the Files-to-Change table now lists tests/test-factory-auth.sh and tests/test-state-dir.sh (Modify), and a new 'Fixture amendment — physical temporary roots' section states the rationale (canonicalize TMP_ROOT with pwd -P; no behavior expectation weakened). I diffed both test files directly against origin/integration/nightshift: each adds exactly one line, `TMP_ROOT=\"$(cd \"$TMP_ROOT\" && pwd -P)\"`, immediately after the existing `mktemp -d` line, with every prior assertion, fail() call, and trap untouched — this matches the task's description exactly and is behavior-preserving (only changes the TMP_ROOT string from a possibly-symlinked logical path to its physical form, consistent with the new resolver's own physical-path canonicalization). One procedural gap, not a code/prompt defect: docs/18/receipts/ is empty and docs/18/runtime-attempts.json only contains the pre-repair attempt-1 rows (claude-conflict fail, claude-legacy fail, codex-* unknown/infrastructure) — none of the post-repair Claude/haiku, Codex/gpt-6-astra, or codex-legacy-fixture-receipt-write runtime evidence cited in the task input is present as a retained artifact in this checkout, so that runtime narrative is unverified from source and this review does not rely on it, per instruction to judge the prompt/spec/test delta rather than model-run claims. No CONFLICT findings — no actionable blocking defect found in the reviewed delta.",
  "results": {
    "claims": [
      {
        "claim": "agents/nightshift-run-all-tests.md Step 1's new 'Mandatory pre-execution gate' requires reading every path in the resolver's `conventions` array (both AGENTS.md and CLAUDE.md when present), blocks with AGENT BLOCKED naming both sources+line numbers on a cross-source explicit-command conflict, restricts legacy fallback to when the neutral source is silent, and requires recording the selected command/source-path+line/scope/fallback rationale before execution — matching docs/PROJECT-CONTEXT.md's Convention decision steps 1-3 and SPEC.md AC1/AC4.",
        "file": "agents/nightshift-run-all-tests.md",
        "line": 22,
        "status": "VERIFIED",
        "inspected_files": [
          "agents/nightshift-run-all-tests.md",
          "docs/PROJECT-CONTEXT.md",
          "docs/18/SPEC.md"
        ]
      },
      {
        "claim": "scripts/nightshift-project-context.py's discover() populates the `conventions` list field (exact key name used by the prompt) by appending, for every ancestor from project root to scope, first AGENTS.md then CLAUDE.md if each exists/resolves inside the project and is readable — confirming the prompt's 'AGENTS.md and CLAUDE.md when both are present' / 'AGENTS.md first' claims are not invented.",
        "file": "scripts/nightshift-project-context.py",
        "line": 51,
        "status": "VERIFIED",
        "inspected_files": [
          "scripts/nightshift-project-context.py"
        ]
      },
      {
        "claim": "docs/18/SPEC.md's Files-to-Change table was amended to add `tests/test-factory-auth.sh` and `tests/test-state-dir.sh` (Modify), and a new 'Fixture amendment — physical temporary roots' section documents the pwd -P canonicalization rationale and states every auth/state assertion is preserved.",
        "file": "docs/18/SPEC.md",
        "line": 69,
        "status": "VERIFIED",
        "inspected_files": [
          "docs/18/SPEC.md"
        ]
      },
      {
        "claim": "tests/test-state-dir.sh's only change vs origin/integration/nightshift is one added line, TMP_ROOT=\"$(cd \"$TMP_ROOT\" && pwd -P)\", immediately after the existing mktemp -d assignment; no assertion, fail(), or trap line is modified.",
        "file": "tests/test-state-dir.sh",
        "line": 7,
        "status": "VERIFIED",
        "inspected_files": [
          "tests/test-state-dir.sh"
        ]
      },
      {
        "claim": "tests/test-factory-auth.sh's only change vs origin/integration/nightshift is one added line, TMP_ROOT=\"$(cd \"$TMP_ROOT\" && pwd -P)\", immediately after the existing mktemp -d assignment; no assertion, fail(), or trap line is modified.",
        "file": "tests/test-factory-auth.sh",
        "line": 8,
        "status": "VERIFIED",
        "inspected_files": [
          "tests/test-factory-auth.sh"
        ]
      },
      {
        "claim": "The prompt's 'structured status FAIL, passed 0' phrasing for an AGENT BLOCKED result matches the pre-existing documented dispatcher JSON contract for this role (status SUCCESS|FAIL|SKIP; results carry nonnegative passed/failed counts for test-role results) rather than introducing a new/undocumented field.",
        "file": "README.md",
        "line": 400,
        "status": "VERIFIED",
        "inspected_files": [
          "README.md",
          "commands/nightshift-implement.md"
        ]
      },
      {
        "claim": "Post-repair runtime evidence cited in the task (repaired-prompt Claude/haiku and Codex/gpt-6-astra conflict-fixture reruns producing FAIL with zero execution; Codex legacy fixture-receipt-write failure under read-only sandbox) is not present as a retained artifact in this checkout: docs/18/receipts/ is empty and docs/18/runtime-attempts.json contains only the pre-repair attempt-1 rows (claude-conflict fail, claude-legacy fail, codex-conflict/codex-legacy unknown/infrastructure, model gpt-5.4 unavailable). This is a procedural evidence gap, not a defect in the reviewed prompt or test changes, and this review's APPROVE does not rely on the unretained runtime narrative.",
        "file": "docs/18/runtime-attempts.json",
        "line": 1,
        "status": "NOT_FOUND",
        "inspected_files": [
          "docs/18/runtime-attempts.json",
          "docs/18/receipts"
        ]
      }
    ]
  },
  "rules_fired": [
    "delta-scoped-to-prior-approved-review",
    "diff-scoped-to-origin/integration/nightshift",
    "read-spec-and-project-context-doc",
    "read-changed-prompt-file-in-full",
    "verify-resolver-field-names-against-source",
    "verify-fixture-diff-line-by-line",
    "no-runtime-claims-without-retained-artifact",
    "no-install-no-coach-no-main-scope-respected"
  ]
}
